argument_id,chunk,topic,rank,polarity_score
332,"Not the best traction on well worn rocks , but",10,0.16947834696604144,1.0
332,"No blisters , no achilles pain like with other shoes .",8,0.16816753213710925,-0.125
332,"Will continue to purchase Nike shoes , because my feet love them for all activities !",17,0.16514114570082683,0.625
332,"( except my home workouts , they drag pretty hard on the carpet )",3,0.1694499951312259,-0.04722222222222223
333,A - MA - ZING !  ,-1,0.14054335227686618,0.0
333,"these make me feel like "" Forest Gump """,15,0.14357910502103302,0.0
333,I needed a good jogging shoe and .  ,0,0.14364093932971544,0.7
333,I felt like I was running on a cloud .  ,7,0.1438217669973909,0.0
333,I have narrow feet and these fit perfectly .  ,15,0.142524370678355,0.39999999999999997
333,I am so happy that I am going to purchase another two pair as back - ups for once it 's time to replace them .  ,16,0.14282228557514245,0.4
333,"Highly recommend to women who like to walk or run and light a light weight , comfortable shoe .",0,0.14306818012149683,0.34
334,lightweight,9,0.16697102107458056,0.0
334,Comfortable and .,7,0.1662270819973608,0.4
334,Need a good training shoe that 's also supportive and flexible .  ,0,0.1631110892158022,0.6
334,had to get 1/2 size larger as this style in my size,4,0.1650674559003213,0.0
334,is too perfect from heel to toe,15,0.1695898571485357,1.0
334,"I really like the fit , but .",1,0.1690334946633992,0.30000000000000004
335,Excellent,14,1.0,1.0
336,These shoes are awesome !  ,23,0.13949535406409605,1.0
336,feel great on my feet,8,0.14281867131407208,0.8
336,They are nearly weightless and .  ,9,0.14145875975593294,0.1
336,The first day I wore them I wore them ALL day on vacation .  ,3,0.14568599390185186,0.25
336,did the same,6,0.1393965719022685,0.0
336,I put them on the next day and .  ,3,0.14580174056383924,0.0
336,"Besides the comfort , they are really a cool color !",5,0.1453429084979393,0.4375
337,Super cute !,20,1.0,0.47916666666666663
338,perfect,14,1.0,1.0
339,This is the most comfortable shoe I 've ever had .,0,0.1119609300905896,0.45
339,work like it 's suppose to,1,0.10516459051963373,0.0
339,"No other shoe can compare to how the individual nubs on the bottom allow your foot to be cushioned , yet .",0,0.11209738375379144,0.03125
339,"My feet feel cradled in this shoe and hard surfaces do n't make my feet ache anymore . 

",15,0.11185467989169795,-0.2916666666666667
339,"These shoes have a small amount of support , but not much , which I like as I 'm coming from vibram five fingers .",0,0.11232815430770773,-0.175
339,"( Sorry vffs , I 'm bailing after 2 years of shin splints , no matter what I did ) . 

",3,0.1117048834198276,-0.5
339,Highly recommended for walking / running on concrete or tracks .,3,0.11188111291012867,0.15500000000000003
339,"As long as nike continues to make the flex supreme , they will get my money .",17,0.11172824980342982,-0.05
339,Please do n't change this shoe !,20,0.11128001530319342,0.0
340,my heel slips on turns .,8,0.2499090676792545,0.0
340,I wear them for Zumba and,3,0.25171429321501837,0.0
340,A little annoying because I have to pay attention,15,0.25140618416392724,-0.49375
340,"but they are so cute and comfy , it balances out .",5,0.2469704549417999,0.5
341,These run large .,4,0.17043796553263374,0.21428571428571427
341,"these I bought a 9 , and the toe area is pretty wide plus plenty long even with socks .",4,0.16893037547219078,0.03333333333333333
341,"I wear a 9.5 exactly in every shoe , but",4,0.16722954590718572,0.25
341,Very comfy and very nice looking shoe .,20,0.15772822281501792,0.49
341,glad I was able to try them on before purchasing,22,0.17066248628182232,0.5
341,I love them but .,2,0.16501140399114936,0.5
342,"Perfect fit , very comfortable , and a great color .",1,0.5,0.6799999999999999
342,They also fit as expected .,1,0.5,0.15000000000000002
343,Really comfy and nice color,20,1.0,0.4
344,"The picture makes the shoe look like it has a "" boxier "" toe rather than the "" pointier "" toe that it actually has .",19,0.14326439306872826,0.0
344,generally need to buy a size or half size longer to get a comfortable width ( in any brand of shoe ),4,0.14219218420649246,0.09444444444444446
344,I have wider feet and .,15,0.14212467246906368,0.0
344,"I feel that the pictures of this shoe did n't accurately depict what I received , in that one detail .",19,0.1430974248774091,0.4000000000000001
344,"I was shooting for a rounder , broader toe design which is more comfortable for me , and",15,0.14320893428597237,0.45
344,"Otherwise , "" the shoe fits . """,1,0.14304426366174483,0.0
344,So I am wearing it .,12,0.14306812743058925,0.0
345,These are the most comfortable shoes I 've used for working out .,0,0.2490830871655127,0.45
345,flexible,18,0.24575512318049883,0.0
345,Extremely light weight and .,9,0.25371361291132066,0.4
345,Loved them so much I purchased two more pair in different colors .,16,0.25144817674266773,0.35
346,looks great,11,0.4999999873405284,0.8
346,Very comfortable and !,7,0.5000000126594716,0.65
347,Love this shoes so comfy and great very everyday use .,3,0.5000000126281949,0.3466666666666667
347,Runs big,4,0.4999999873718051,0.0
348,fit,1,0.5000000063328573,0.4
348,Nice looking and nice,11,0.4999999936671426,0.6
349,on my feet all day long,8,0.03601082657053518,-0.05
349,I am a recess aide and .,13,0.035698778424937745,0.0
349,I tried these shoes on in the store before purchasing them on Amazon .,22,0.03507652212729129,0.0
349,They are very lightweight and comfortable .,5,0.03533296452693036,0.30000000000000004
349,I was surprised how great they felt .,5,0.03563292986383037,0.45
349,I have n't had a pair of Nikes since Nike shoxs came out .,17,0.035281805418013755,0.0
349,They are so much more lightweight than those .,9,0.034575401596321186,0.5
349,had no problems,8,0.03510562007371537,0.0
349,I wore them an entire day the first day and .,3,0.03624802193333919,0.125
349,"The second day ; however , I got a pain in my hip to the point where I started limping .",8,0.03604377209811901,0.0
349,"As soon as I got home and took them off , the pain was gone the rest of the evening .",8,0.036123978522828025,0.0
349,I 'm only 30 by the way .,9,0.035834331243189944,0.0
349,Nothing else in my daily routine changed except wearing these shoes two days in a row .,3,0.03623981214666998,0.0
349,I 'm sure that was the problem .,17,0.03611508352232225,0.5
349,"I do n't understand why it would make my hip hurt since they are comfortable on my feet , but",8,0.03592672750796227,0.4
349,had no pain,8,0.035973067156044355,0.0
349,I wore different shoes today and .,16,0.03623491604172961,0.0
349,I do n't think as much as I am on my feet I will be able to wear them an extended amount of time .,3,0.03628245444791396,0.35
349,I will have to rotate wearing them every other day .,3,0.036248617459914576,-0.125
349,"For normal wear , I believe , people will be fine .",5,0.036294235150213267,0.2833333333333333
349,standing six hours a day straight,10,0.03591745432929264,0.2
349,"I am literally walking or . 

",13,0.035866003129012065,0.0
349,* * UPDATE :,6,0.03407317722161177,0.0
349,"So , initially after wearing them , I had hip pain after wearing them .",8,0.036077011917474804,0.0
349,I wear them all the time now and have not experienced any pain since the first couple times of wearing them .,12,0.036154667650898524,-0.07500000000000001
349,"I do n't know if they just needed to be broken in , but",7,0.03627602422005354,-0.4
349,I love them even more now .,2,0.03379218622352471,0.5
349,"They are comfortable , and",5,0.0355636094763102,0.4
350,Perfict fit for me .,1,0.5000000062863202,0.4
350,Great looking shoes at a great price .,20,0.49999999371367976,0.8
351,The sneakers are very comfortable and fit to size .,0,1.0,0.46
352,have so far enjoyed using them,10,0.16838134396244755,0.3
352,I 've had these shoes for about a week now and .,13,0.16808756460671295,0.0
352,"Considering the fact that I have wide feet , the shoes are slightly tight .",15,0.16807416355489557,-0.1392857142857143
352,does it bothers me as I use them throughout my workouts,3,0.16880753118995237,0.0
352,"However , it does n't feel uncomfortable nor .",15,0.1586875746201338,-0.5
352,I know some people personally like when the shoes are a bit tighter or a bit looser so it 's all in personal preference .,15,0.16796182206585744,0.0
353,I really like them !,2,1.0,0.25
354,Good light weight shoe ... had to add insole for more support .,0,1.0,0.5333333333333333
355,I love my tennis shoes,10,1.0,0.5
356,I am not impressed .  ,-1,0.16668777550052657,-0.5
356,"This is a shoe I will wear with black dress pants or jeans when I need comfort and a little style , but",0,0.1672850557944305,-0.17708333333333331
356,This is a very flimsy shoe with little support at all .  ,21,0.16992279336323954,0.0062500000000000056
356,Not like any Nike I 've ever purchased in the past .  ,17,0.1670077946161165,-0.25
356,it 's not comfortable .,18,0.15996622655964496,-0.2
356,"It looks nice , but",20,0.16913035416604164,0.6
357,Love it ! !,2,0.20291110123446907,0.78125
357,nice,14,0.2017235361515648,0.6
357,Super comfortable and ! !,7,0.1988689865519971,0.47916666666666663
357,"Got more than I expected , super flexible great for training .",18,0.1939898922240529,0.38333333333333336
357,Definetly recommend it .,22,0.20250648383791608,0.0
358,Excelente,-1,1.0,0.0
359,I do n't expect them to last more that one summer .  ,7,0.25343635665389497,0.25
359,These shoes are poorly constructed and,19,0.2507792270171192,-0.4
359,will not order another Nike downshifter series again,4,0.251702013703136,0.0
359,"Would not recommend , and",22,0.24408240262584985,0.0
360,"For the price I spent on the pair of shoes , I 'd say it 's as good as expected . 
",20,0.33618354070341827,0.16666666666666666
360,does n't hurt my feet when I run,8,0.33628708910922067,0.0
360,It 's comfortable and .,7,0.327529370187361,0.4
361,I love this shoes they are so comfortable,0,1.0,0.45
362,I absolutely LOVE these shoes .,10,0.10012298053530246,0.5
362,These are my absolute favorite .,2,0.09892936919426207,0.35
362,comfortable,18,0.09255572436903943,0.4
362,So light and .,9,0.09851802860597562,0.4
362,These are actually my 2nd pair .,16,0.10163821341452159,0.0
362,they look good still .,20,0.10241149387824286,0.7
362,I am still wearing my 1st pair after 2 years and,3,0.10165194859340551,0.0
362,I want a back up pair for when my 1st pair wears out .,16,0.10187163508454421,0.0
362,I am just afraid they are going to disappear and,16,0.1022729112479652,-0.6
362,These have been the best shoes I 've owned !,17,0.10002769507674099,1.0
363,Perfect fit !,1,1.0,0.75
364,My favorite cross trainers !,10,1.0,0.25
365,Love them fit perfect,1,1.0,0.6333333333333333
366,Favorite Nike shoe ever !,10,0.12555044404890134,0.625
366,The flex sole is excellent for someone like me who loves the free feeling of sandals or being barefoot .,14,0.12698538604388415,0.4666666666666666
366,These move effortlessly with the bend of my foot .,0,0.12641225148559165,0.0
366,I 've had no foot or ankle pain .,8,0.12575474569124645,0.0
366,I 've worn these for multiple activities and,3,0.12850706295454473,0.0
366,the mesh breathes perfectly on hot summer days .,7,0.12235503405259349,0.25
366,The white / green / dark grey color goes with so many outfits and,11,0.12486316446011622,0.020000000000000007
366,Highly recommend !,22,0.11957191126312194,0.2
367,"I wear these everyday to work , the gym , etc .",3,1.0,-0.2
368,Love these shoes !,23,0.5,0.625
368,"Great fit , very light weight .",9,0.5,0.5733333333333334
369,fit my small feet perfectly,1,0.12415035331126031,0.3833333333333333
369,Super comfortable and .,7,0.12178353199573963,0.3666666666666667
369,I have flat feet so a lot of shoes are not comfortable for long periods of time .,8,0.12461301350919769,-0.09166666666666667
369,they are super comfortable .,5,0.1256361282520659,0.3666666666666667
369,I can wear the shoe all day long and,3,0.12541442220422078,-0.05
369,they are easy to clean compared to other shoes I ve had .,0,0.12661774104555287,0.225
369,"They are light colored so any dirt will be seen right away , but",18,0.12686335732906806,0.34285714285714286
369,Would definitely buy another pair in a different color .,16,0.1249214523528947,0.0
370,Love these shoes !,23,1.0,0.625
