argument_id,chunk,topic,rank,polarity_score
236,It was more orange then red .  ,11,0.33401195267297024,0.25
236,Not sure that I am going to keep them .,16,0.3325870537347653,-0.25
237,Perfect fit !,1,0.16926075680030223,0.75
237,on sale,6,0.1703338957238738,0.0
237,Brand new in new box completely perfect condition and ! ! !,1,0.16510216729545035,0.42424242424242425
237,Awesome !,14,0.166270944885955,1.0
237,Highly reccomend !,22,0.16902545051484968,0.2
237,Super cute shoes .,20,0.16000678477956873,0.41666666666666663
238,Squeaky,7,1.0,0.0
239,"If you wear Nike on the regular , then you should pretty much know your size .",4,0.09942651530502788,0.15
239,it fit just as expected .,1,0.09821672922417818,0.15000000000000002
239,"I wear only 7 's in Nike , and",4,0.09708537625292016,0.0
239,love them all,2,0.09861690965260791,0.5
239,"I have many of the trail runner generations , and .",13,0.1020360888212892,0.5
239,"they 're my go to sneakers for the gym use , or casual wear .",0,0.09998214733541043,-0.5000000000000001
239,I have a pair I used mostly for casual wear that have lasted about 5 years .,0,0.10253926546945448,-5.551115123125783e-17
239,Another pair that I used for cross fit / outdoor runs that lasted a little over a year ( very vigorous daily use ) .,4,0.10207846851019181,0.0825
239,"All in all , these shoes are great for me .",20,0.10061087709977956,0.8
239,"They 're lightweight , and comfortable .",5,0.09940762232914029,0.4
240,cushion,5,0.33012477940362717,0.0
240,Great arch support and both for the heel and ball of the foot .,21,0.33684434352278064,0.8
240,Great aerobic shoe !,20,0.33303087707359186,1.0
241,"Good quality , perfect fit .  ",1,0.4999999874051888,0.7000000000000001
241,It 's a Nike !,17,0.5000000125948112,0.0
242,"purchased 8.5 for a more comfortable feel , considering shrinkage as a result of perspiration",4,0.5,0.45
242,"Size 8 , but .",4,0.5,0.0
243,these are too long- at least an inch and 1/2 .,15,0.5000000063325027,-0.175
243,"I 've always gotten this size in Nike shoes with similar description , but",4,0.49999999366749714,0.0
244,Very lightweight .,9,0.33288830065984676,0.2
244,Normal Nike quality .,17,0.32717400269823754,0.15
244,"Pink is very bright , colors look great together .",11,0.33993769664191564,0.5366666666666667
245,Love them ! !,2,1.0,0.78125
246,Arrived on time .,6,0.20080189714657293,0.0
246,if I wear thick socks they are fine,8,0.1975923364076847,0.05833333333333332
246,"I probably should have gone with a 7.5 instead of an 8 because they do seem a little big , but .",4,0.20102941311199693,-0.09375
246,"Also , they can sometimes make a very annoying squeaky noise when I run on certain surfaces so I 'm trying to get them worn in .",7,0.199741588783491,-0.39285714285714285
246,"Over - all , I am satisfied with my purchase !",6,0.20083476455025445,0.625
247,After less than a week the sole ripped off on the outside of the shoe,21,1.0,-0.05555555555555555
248,The lines do n't really show up unless there is a bright light on them .,11,0.20019427617825342,0.4333333333333334
248,that they are perfect,2,0.19901501476398867,1.0
248,But other than .,-1,0.20198602200163193,-0.125
248,are comfortable the first time you put them on,5,0.19819265195372793,0.325
248,They are very true to size and .,1,0.20061203510239803,0.45499999999999996
249,I love these !  ,2,0.252472179543872,0.625
249,I ordered an 8.5 which is my normal shoe size and they fit great .  ,4,0.24708571155170012,0.45
249,"they performed well , and they are sooooo pretty !  ",2,0.2530583534972751,0.3125
249,"I used them for my strength training class and Comfortable , low profile and stylish !",0,0.24738375540715274,0.3416666666666666
250,comfortable,18,0.49999999367779396,0.4
250,Cute and,11,0.500000006322206,0.5
251,Very comfortable .,7,1.0,0.52
252,Sizing was perfect as ordered .,1,0.5,1.0
252,"Quality appears good , still new , not too much more to report .",1,0.5,0.4454545454545455
253,Size really depends on the brand .  ,4,0.20355825890603427,0.2
253,they fit me perfectly .  ,1,0.1965585228455429,0.7
253,I wear a 6.5 in Nike and,4,0.1996786590059915,0.0
253,do not restrict movement,-1,0.20072931882818898,0.0
253,"These shoes are comfortable , they wrap around my feet like a bandage but .",0,0.19947524041424225,0.4
254,I was really excited when I opened the box to see the color is exactly like the image shows !,11,0.2491206741457509,0.34375
254,used the same size to order these,4,0.24970105738729703,0.0
254,I have the Nike flex tr 5 and .,17,0.24732980899197157,0.0
254,They are a little bigger than expected but still comfortable .,4,0.25384845947498047,0.02812500000000001
255,Returning these .,24,0.16418207972619775,0.0
255,the pictures on here make the shoe appear all black with a touch of pink in the check .,11,0.1689416350498473,-0.13333333333333333
255,"however , the whole shoe has pink coming through .",19,0.16888899138114283,0.05
255,I was looking for an all black shoe .,20,0.16728125950666373,-0.16666666666666666
255,love them,2,0.16439206404748807,0.5
255,I ordered the Nike Women 's Flex Supreme TR3 instead and ! ! !,17,0.1663139702886601,0.0
256,"wow these are the most comfortable , light weight shoes .",0,0.5,0.35
256,I love them ! !,2,0.5,0.78125
257,love the lightweight and the fit,23,1.0,0.45
258,"fits perfect , my daughter loves them",1,1.0,1.0
259,"Finally , after trying about 10 pairs of Nike 's , these were a perfect fit .  ",16,0.49999998733591283,0.4666666666666666
259,"They are light and very comfortable , I really just forget about my feet when I 'm wearing them .",5,0.5000000126640871,0.37333333333333335
260,my daughter LOVES them,12,0.4999999873637722,0.0
260,Came quick and,6,0.5000000126362278,0.3333333333333333
261,Great Gift - she loved it !  ,12,0.5000000126608675,0.8375
261,It 's a nice shoe !,20,0.4999999873391325,0.75
262,she loves them .  ,12,0.33468403304425953,0.0
262,Bought these for my daughter and,12,0.3354482484704029,0.0
262,"She tried them on at a retail store a couple months prior , so I knew her exact size .",12,0.3298677184853374,0.125
263,fast shipping,6,0.4999999746681546,0.2
263,Great product and !,6,0.5000000253318454,1.0
264,bought it online,16,0.25108485394638436,0.0
264,Tried one in the store and,4,0.25165785278678826,0.0
264,but it was a different   kind of shoe .,19,0.24712935935286887,0.3
264,"Too big , different fit !",16,0.2501279339139585,0.16666666666666666
265,"of all my aches and pains , my feet was not one of them .",8,0.24671856469543701,0.0
265,I had the older generation of this shoe that survived 2 or 3 mud runs and,20,0.25122673791630634,0.16666666666666666
265,This is because of this shoe .,20,0.25098491001504764,0.0
265,Nike really dropped the mic with this .,17,0.25106978737320895,0.2
266,This pair fits perfect ..... the first pair was wrong size in the right box ..... definitely order again ! ! ! ! !,4,1.0,0.20714285714285713
267,I returned these as they were not true to size .,24,0.49999999366724535,-0.175
267,They ran large .,0,0.5000000063327547,0.21428571428571427
268,wrong shoes,4,1.0,-0.5
269,There very nice,2,1.0,0.78
270,I actually have 3 pairs of these trainers .  ,16,0.24976549612087426,0.0
270,"They are very comfortable , there is a neoprene sleeve that goes around your ankle that makes them the most comfortable for me compared to normal athletic shoes .  ",18,0.24896852176341075,0.39249999999999996
270,"this is perfect , but you may want to round up on the size or try on in the store first if your feet are on the wider side .",4,0.2504261804373849,0.35000000000000003
270,They run a little narrow - for me,15,0.2508398016783301,-0.19375
271,Just too big otherwise I liked them !,2,1.0,0.375
272,Comfortable shoe .  ,0,0.500000006271049,0.4
272,I would buy again,6,0.49999999372895104,0.0
273,comfortable,18,0.5000000126564843,0.4
273,Light weight and .,9,0.49999998734351564,0.4
274,Fit my size perfectly and very comfortable !,1,1.0,0.6833333333333332
275,Love these shoes !,23,0.197274467780691,0.625
275,these are perfect .,2,0.2027369149846857,1.0
275,Needed new running shoes and,0,0.19576513450267882,0.13636363636363635
275,fit great,1,0.20253110590965825,0.6000000000000001
275,Light weight and !,9,0.20169237682228608,0.5
276,Purchased these for our teenage daughter .,12,0.33770165117954665,0.0
276,She loves them .,12,0.33593582449881415,0.0
276,For both casual wear and sports .,0,0.326362524321639,-0.5000000000000001
277,found them really comfortable with no aching feet at the end of the day,0,0.2007012840959011,0.4
277,"Love these shoes , I have worn them all day and .",10,0.20136483914283795,0.5
277,true to size,1,0.1973428762357515,0.35
277,Fantastic colour and .,11,0.19847753090873144,0.4
277,I also bought   Nike Women 's Flex Supreme Tr 3 Pnk Pw / Mtllc Slvr / Cl Gry / White Training Shoe and these shoes are slightly more comfortable than those even though they look very similar .,17,0.20211346961677795,0.225
278,Super light weight comfortable !,5,0.24929401530655532,0.41111111111111115
278,run too,13,0.2509563939805639,0.0
278,Kick box in these and .,0,0.24932849410176686,0.0
278,Good support !,21,0.2504210966111138,0.875
279,they are very comfortable,5,0.07200740947621212,0.52
279,i bought a size 6.5 when I normally where a size 7 .   and even the 6.5 feels a little roomy .  ,4,0.0696725693444799,-0.018750000000000003
279,i bought a pair from DSW for 50 $ and but,16,0.07261463639829667,0.0
279,I have wide flat feet btw .  ,8,0.07165288464106948,-0.0625
279,i m not sure if I will keep them even though i love their look and comfort .  ,18,0.07322035178891315,0.125
279,I think they wo n't give me enough support when running .  ,3,0.07235641175107474,0.0
279,I 've been having feet problems while taking a gym class and,8,0.07136267275108606,0.0
279,i do n't know if they 'll last long if you use them everywhere else .  ,21,0.07344754358335354,-0.025
279,"they 're great for wearing at home or gym and doing exercises in one place- extremely light weight and flexible , but",3,0.07276973283155341,0.6000000000000001
279,:(  ,14,0.06836790829790133,-0.75
279,i really like them,2,0.06976963728734285,0.2
279,"but i ca nt just buy 2 different shoes . 
",17,0.07170411466683067,0.0
279,"also , i really like the strings inside the lining on the side of the shoes to adjust and make the shoe fit snug .",15,0.07210916550481374,0.30000000000000004
279,it makes me feel secure :D,7,0.06894496167707227,0.7
280,really lightweight,9,0.5000000253229517,0.2
280,Not a lot of arch support but .,21,0.4999999746770482,0.0
281,EXCELLENT,14,1.0,1.0
282,Good for non - aerobic workout .,3,0.334336608433096,0.7
282,no support for lateral movrment,21,0.3368562411307942,0.0
282,Mesh was very comfortable but .,7,0.32880715043610953,0.52
283,Favorite Nikes ever .,10,0.1621498492357508,0.5
283,was ready for a new pair,1,0.1671384598927707,0.16818181818181818
283,I already owned this style and,17,0.16930836803321359,0.0
283,so I went with these .,4,0.16749492011375175,0.0
283,they fit great .,1,0.16692134189339156,0.6000000000000001
283,Love the color and,11,0.16698706083112141,0.5
284,Light - weight comfy shoes .,0,1.0,0.4
285,these were the best !,2,0.5,1.0
285,Tried a lot of shoes for cross training and,0,0.5,0.0
286,I love everything else about them !,2,0.4999999873831393,0.625
286,"Wish they had a little more support / cushion , but",5,0.5000000126168607,0.15625
287,These are as far as comfort goes the most comfortable pair of sneakers I have I suffer from sciatica pain that goes into my feet I have difficulty finding the proper support and comfort in shoes I would recommend these most definitely .,0,1.0,0.25
288,After my purchased I found out they are overpriced .,12,0.3360351615187503,0.0
288,They feel good,5,0.33080999583035703,0.7
288,but I will not recommended if you need Wide fit .,22,0.3331548426508925,0.15000000000000002
289,they are too small .,4,0.20259376768574824,-0.25
289,"I bought a pair of these in my size , but",16,0.20091137934897157,0.0
289,I can get my feet in them but not comfortably .,8,0.19942374925650735,-0.2
289,It 's too bad because I can tell the soles are comfortable .,0,0.19805912533580397,-0.1499999999999999
289,"Of course , now I 've work them to work so I ca n't return them .",24,0.1990119783729688,0.0
290,Love them !  ,2,0.3295626353885331,0.625
290,great for weight training,3,0.33303393487948063,0.8
290,Very comfortable and !,7,0.33740342973198606,0.65
291,went up half size,4,0.14308399425828866,-0.16666666666666666
291,it was too large .,4,0.14444359370319318,0.21428571428571427
291,Took other reviewers advice and and,-1,0.14348398183772448,-0.125
291,I thought this was a more sock - like fit,1,0.1432976864900378,0.45
291,but it had a tongue that came up high on my ankle not at all sock like .,19,0.142741542911493,0.16
291,Nice looking and very light weight with a rounded square toe that left plenty of room front foot and toes .,20,0.14008939464974252,0.37333333333333335
291,These just were n't what I was looking for .,20,0.14285980614952015,0.0
292,very cute,20,0.49999999367063525,0.65
292,Really comfortable and .,7,0.5000000063293648,0.4
293,These shoes are great .  ,10,0.3324118251595249,0.8
293,I love them .,2,0.3303528251758418,0.5
293,This is the second pair that I have purchased and,16,0.33723534966463325,0.0
294,Fit to size .,1,0.49999999999999994,0.4
294,Comfortable,18,0.49999999999999994,0.4
295,Picky daughter actually loves them .,12,1.0,0.0
296,Fit like a dream !,1,0.2517991771472675,0.5
296,Great for cross - training / HITT videos I do everyday .,3,0.25032448326859336,0.20000000000000004
296,Great for walking too .,3,0.2501742529414306,0.8
296,Look amazing !,2,0.2477020866427085,0.7500000000000001
297,Most comfortable training shoes I 've worn in a long time .,0,1.0,0.2833333333333333
298,I bought these sneakers for boot camp class .  ,0,0.25000559863943217,0.0
298,They are very light weight and different than other sneakers that I have owned .  ,17,0.2519959812615138,0.13166666666666668
298,like them so far,2,0.24443919651624715,0.1
298,"Have only used them a few times , but .",21,0.25355922358280697,-0.1
299,I got a hot spot on the bottom of my foot the first day I wore them .,8,1.0,0.25
300,Still breaking them in for use at the gym .  ,3,0.33363754800257217,0.0
300,"I think once I get used to them , they 'll work great !  ",21,0.33880825329462405,1.0
300,:),14,0.3275541987028037,0.5
301,Not a fan .,2,0.49999998735654944,0.0
301,Shoes looked great but too narrow for most feet .,15,0.5000000126434505,0.3666666666666667
302,I love these shoes .,10,0.2517608440858172,0.5
302,just take them on longer walks,13,0.25155874027761016,0.0
302,I exercise in them as well as .,3,0.2548439407651294,0.0
302,"Feels good , looks GREAT ! !",20,0.2418364748714433,0.85
303,fits perfect,1,1.0,1.0
304,Very comfortable shoes .,18,0.2504429862455244,0.52
304,I have wide feet with falling arches .,15,0.24974992902076903,-0.1
304,are comfortable enough that I can be in them all day long,5,0.2544221265539407,0.11666666666666668
304,These help both and .,13,0.24538495817976577,0.0
305,are for my requirements,9,0.24874975042538186,0.0
305,"Unfortunately , this Flex Supreme does NOT have enough support over the toe and ankle . 
",15,0.2466811017502637,-0.25
305,Returning for credit .  ,24,0.2501100685705825,0.0
305,Thanks anyway .,-1,0.25445907925377187,0.2
306,After using this shoes seven times for regular activities like walking or dancing the sole came out .,3,0.2447358334650882,0.0
306,I am very disappointed .,-1,0.25119273626126415,-0.9750000000000001
306,I do n't recommend this product at all .,22,0.25273343992562464,0.0
306,The worse part is that I can not return this item because the return window closed 4 days ago .,24,0.2513379903480232,-0.25
307,Fit like gloves to my feet !,1,0.5,0.5
307,Perfect for workouts .,3,0.5,1.0
308,I 've worn these to work out for 5 days in a row now .,3,0.20033588145822281,0.0
308,over time the discomfort subsided entirely .,8,0.20001835616969652,0.0
308,"Initially , my arches ached but",8,0.20039993920346794,0.0
308,"I 've done everything from bootcamps , resistance training , running and Zumba .",13,0.20021368800172823,0.0
308,"So yeah .. , they are truly crosstrainers ;-)",-1,0.19903213516688448,0.25
309,I liked these shoes a lot .,2,0.24868275637003717,0.6
309,Very light weight .,9,0.25124490561474444,0.52
309,I did n't give a 5 because the color was a little lighter than I thought it was going to be but still a great shoe .,19,0.2518276929530596,0.30625
309,Very comfortable,7,0.24824464506215874,0.52
310,Love them ! ! !,2,1.0,0.9765625
311,I love these shoes !,23,0.3290864877735492,0.625
311,perfect for cardio,3,0.33776445526649546,1.0
311,Great arch support and .,21,0.333149056959955,0.8
312,find that these shoes help give me good support   with my endurance workouts,0,0.4999999746694064,0.7
312,I workout at the local crossfit and .,13,0.5000000253305936,0.0
313,These shoes look really great .,10,0.19496732101365594,0.8
313,"However , slightly loose .",15,0.2001364615084369,-0.07692307692307693
313,The problems with lack of support arose when I exercised .,8,0.20102784112560765,0.0
313,It feels like there is little to no support in them .,21,0.20223558716666387,-0.1875
313,Possibly this is a shoe more geared for an office environment or short walking distances .,20,0.20163278918563562,0.16666666666666666
314,These are my favorite walk around shoes !,10,0.2523783413977268,0.625
314,not be in pain,8,0.2500330939703732,0.0
314,I can wear them all day and !,3,0.2559385392979009,0.0
314,Love em !,2,0.24165002533399918,0.625
315,walking - around sneakers,0,0.06245467970119962,0.0
315,"Favorite training and . 
",10,0.06273253418717181,0.5
315,are comfortable for most situations,5,0.060800339585418285,0.45
315,"They look good with just about anything , and . 
",20,0.06107464077202343,0.7
315,"With the exception of running ( for which I use proper Mizuno running sneakers with an arch - support insole ) , these sneakers are my go - to . 
",0,0.06274534339560746,0.0
315,"If I could , I 'd take away a 1/2 star for arch support - I have a slightly wider front of the foot and arches that are a little on the high side , so I do look for a good under the foot fit .",15,0.062330882643025304,0.18116666666666667
315,put in an insole(they're pretty expensive ),0,0.06291755626637592,-0.125
315,"as is , when I did a zumba class in these , my arch began to twinge :( 
",21,0.06290191328613444,-0.75
315,"I could probably tie the laces differently or , but",15,0.06261117846201697,0.0
315,for training and gym use ( with the exception of running and zumba ( although hip - hop was fine ) .,3,0.06302542317091737,0.4166666666666667
315,"However , this is overall an awesome shoe that I will continue to stick with for going out , day to day walking , and",23,0.06273008483460989,0.5
315,"do n't look "" dirty "" easily",4,0.06296857286335752,-0.08333333333333331
315,The shoes have a great flexibility to them and .,0,0.06268674873261193,0.8
315,are just now on the verge of being worn out,14,0.06246698030352385,0.0
315,My previous pair of flex supreme TR 3s have lasted for a good 2 years and .,17,0.06287118500900388,0.26666666666666666
315,"This is the optimal sneaker that is flexible in more ways than one : from pointing you toes to leg - pressing , from gym use to shopping to adding a sporty edge to a dressy night out , the flex has it all .",18,0.06268193678700226,0.5
316,Love these !,2,0.49999998113532984,0.625
316,"I have 3 pairs ... they're so comfortable - I 'm on my feet all day & my feet actually do n't hurt at the end of the day when I wear these :) 
 I 've learned to get these 1/2 size smaller .... I'm normally a size 7 and the 6 1/2 fit perfectly",4,0.50000001886467,0.35000000000000003
317,Great shoes .,20,0.3237829165731768,0.8
317,comfortable,18,0.3317594887861971,0.4
317,Lightweight and,9,0.34445759464062586,0.0
318,BEST .,14,0.1609434515728839,1.0
318,SHOES .,0,0.16425435214328335,0.0
318,EVER .  ,-1,0.16895864642594968,0.0
318,I bought two pairs in different colors- black n ' white and the pink and white ...  ,16,0.16862656696684042,-0.05333333333333333
318,They have AWESOME support for whatever you use them for ..,21,0.16981048972386187,1.0
318,I have one for work and the other for training / running / etc in ...,3,0.16740649316718062,-0.125
319,These sneakers give me the motivation to workout because they feel so good and are great for any training,0,1.0,0.75
320,I LOVE the look and comfort of these shoes for style and lifting weights .,0,0.05544264816965677,0.5
320,Super cute and flezable .,7,0.05161703924256514,0.41666666666666663
320,"BUT for running , absolutely not ! !",3,0.05613784101181868,-0.15625
320,just do not work for my personal stride,13,0.05603378759669983,0.0
320,It might just be my pronation / supnation and these shoes .,14,0.05584582149491972,0.0
320,I run about 2 - 4 miles every few days .,13,0.05592029168178507,-0.2
320,then sprints twice a week on a treadmill,13,0.056046858741894495,0.0
320,Average of 8 miles a week and .,13,0.055925388949494115,-0.15
320,"Just after running with these 3 times , I am having major back issues that I have never had before . 

",3,0.05587447032711386,0.03125
320,other shoes,23,0.05536575339209687,-0.125
320,"MY STATS and : 
 I road and trail run .",13,0.055957486176010277,0.0
320,a lot of heal on the road,13,0.05602634463823669,0.0
320,I run on my tip toes on the treadmill and .,13,0.055973906461681724,0.0
320,I am 5'6 169lbs with more muscle than an average runner .,13,0.05594274959285274,0.175
320,"Built more like a sprinter than a marathon runner . 
",13,0.05604600161002207,0.5
320,I LOVE Nike FLEX bottoms .,17,0.05520346167207406,0.5
320,They really give me support and flex needed .,7,0.054766440732110996,0.2
320,I have also used Asics and Puma .,21,0.05587370850896692,0.0
321,Size 5 .,4,0.3364273936967887,0.0
321,Very comfortable shoes .,0,0.328213536971923,0.52
321,Love !,2,0.3353590693312882,0.625
322,they are amazing !  ,2,0.0882206603862109,0.7500000000000001
322,I bought a wide size of these at a local store and,4,0.09168610126146497,-0.05
322,"Soft , comfy , with moderate support .  ",18,0.09083713025428071,0.05
322,not minimalist .  ,9,0.08876481679058618,0.0
322,"Not a cloud to walk on , but",8,0.09244090955304836,0.0
322,The wide size is perfect for my wide feet with high arches .  ,15,0.09257325171894874,0.24000000000000002
322,"The shoe tends to run about a half size long though , especially for Nike .  ",4,0.09211364310715872,-0.07222222222222223
322,these shoes feel good all day ...,20,0.09106485539695704,0.7
322,"I am working on getting in shape , and",13,0.09136541995098713,0.0
322,No rubbing on my big toe joint or pinkie toe or heel .  ,8,0.09134223772145128,0.0
322,Very pleased .,6,0.08959097385890603,0.65
323,I always buy the same size this ones came to large,4,1.0,0.10714285714285714
324,"Nice shoes , fit good",20,1.0,0.5666666666666667
325,I bought these for my wife .,12,0.11327684612629524,0.0
325,did not have their size so i ordered on amazon,4,0.11111988486496385,0.0
325,She saw them in the store but .,12,0.11298063887202373,0.0
325,She loves them .,12,0.1128799116585357,0.0
325,no complains at all,6,0.11005002780871065,0.0
325,She already had for a couple of months and .,12,0.11289730733389658,0.0
325,One of her favorites shoes for running or for her job since she walks a lot in the warehouse .,7,0.10661052961264361,0.0
325,Now she loves me more .,12,0.11287923988840759,0.5
325,:),14,0.107305613834523,0.5
326,Love these shoes .,10,0.13978207004491952,0.5
326,my old shoes were uncomfortable .,15,0.14423563431742975,-0.2
326,My feet have been weird since I was pregnant and,8,0.14266641534833943,-0.08333333333333334
326,help me get active,13,0.14308459504725005,-0.13333333333333333
326,These are very comfy and .,5,0.14388548192432443,0.2
326,go with anything,-1,0.1425990380755228,0.0
326,They are also stylish and .,5,0.14374676524221383,0.5
327,"Look better than the picture , very comfortable , great support .",5,1.0,0.6066666666666667
328,Love my new Nike 's .  ,17,0.12474631397846662,0.3181818181818182
328,and I just could n't wear them any more ),3,0.12649966155173326,0.5
328,now the new styles and sizing are perfect .  ,1,0.12199989516958126,0.5681818181818181
328,It 's been years since I 've been able to wear them ( sizing changed years ago but,3,0.12680834292202264,0.5
328,Lightweight shoe with tons of style .  ,0,0.12368049230644254,0.0
328,The Fog color is just what I was looking for ... not black and not neon !  ,11,0.12339314845679658,0.10416666666666666
328,they held up great !,9,0.12649567751336022,1.0
328,I wore them to participate in Relay for Life ( 24 hour walk ) and,3,0.1263764681015968,0.0
329,I am so happy with this purchase .,6,0.1562239032020008,0.8
329,I feel like I 'm barely wearing a sneaker when working out .,0,0.16872529169520428,0.05
329,"Another plus is that when I take off my sneaker , my sock is barely sweaty !",0,0.16863502234261796,0.0625
329,I have never had that experience with a shoe .,20,0.1697470257458128,0.0
329,looks nice on my feet,20,0.16988261437339564,0.6
329,The shoe is also very attractive and flattering and .,20,0.1667861426409683,1.0
330,Absolutely love them .,2,0.49999999999999994,0.5
330,Can even wear them without my insoles .,4,0.49999999999999994,0.0
331,"Super cute shoe however runs wide and big , I 'm a size 10 however this size 10 is too big .",4,0.3361884484674917,0.14666666666666667
331,"tried the same shoe on   turns out with this particular shoe I 'm a 9.5 , so order half the size u normally are",4,0.3343772514666263,0.0375
331,I went to a sporting goods store and .,3,0.3294343000658819,0.0
332,Wore these for the first time hiking the bluffs .,20,0.16914369029850454,0.25
332,super comfy .,7,0.15861928976629172,0.3333333333333333
